[
  {
    "id": "pasteurization_wine_1863_1865",
    "name": "Pasteurización aplicada al vino",
    "type": "preservation_technology",
    "period": {
      "start": 1863,
      "end": 1865,
      "precision": "range",
      "display": "1863–1865"
    },
    "placeRefs": [
      "arbois_france"
    ],
    "contextRefs": [],
    "impactSubjectRefs": [
      "wine"
    ],
    "impactTypes": [
      "extends_shelf_life"
    ],
    "summary": "Pasteur investigó las alteraciones microbianas del vino desde 1863 y patentó en 1865 un procedimiento de conservación mediante calentamiento moderado protegido del aire.",
    "certainty": "high",
    "sourceRefs": [
      "src_pasteur_legacy",
      "src_pasteur_middle_years",
      "src_science_history_pasteur",
      "src_pasteur_letter_1866"
    ],
    "status": "verified",
    "verification": {
      "verifiedOn": "2026-08-11",
      "method": "independent_institutional_and_primary_review",
      "independentSourceRefs": [
        "src_science_history_pasteur",
        "src_pasteur_letter_1866"
      ],
      "note": "La cronología del Institut Pasteur se contrastó con Science History Institute y correspondencia primaria de Pasteur."
    }
  },
  {
    "id": "perkins_mechanical_refrigeration_1834",
    "name": "Patente de refrigeración mecánica de Jacob Perkins",
    "type": "refrigeration",
    "period": {
      "start": 1834,
      "end": 1834,
      "precision": "exact",
      "display": "1834"
    },
    "placeRefs": [],
    "contextRefs": [],
    "impactSubjectRefs": [],
    "impactTypes": [
      "enables"
    ],
    "summary": "La cronología histórica de ASHRAE registra en 1834 la patente de Jacob Perkins para una máquina de refrigeración mecánica; Smithsonian conserva un modelo asociado a esa fecha.",
    "certainty": "high",
    "sourceRefs": [
      "src_ashrae_refrigeration_timeline",
      "src_smithsonian_perkins_1834"
    ],
    "status": "verified",
    "verification": {
      "verifiedOn": "2026-08-11",
      "method": "independent_museum_review",
      "independentSourceRefs": [
        "src_smithsonian_perkins_1834"
      ],
      "note": "La cronología de ASHRAE se contrastó con el objeto/documentación histórica del Smithsonian."
    }
  },
  {
    "id": "monitor_top_refrigerator_1927",
    "name": "General Electric Monitor Top y refrigeración doméstica eléctrica",
    "type": "food_storage_appliance",
    "period": {
      "start": 1927,
      "end": 1927,
      "precision": "exact",
      "display": "1927"
    },
    "placeRefs": [],
    "contextRefs": [],
    "impactSubjectRefs": [],
    "impactTypes": [
      "extends_shelf_life",
      "changes_domestic_cooking"
    ],
    "summary": "Smithsonian identifica el General Electric Monitor Top, introducido en 1927, como el primer refrigerador que alcanzó amplia popularidad en los hogares estadounidenses.",
    "certainty": "high",
    "sourceRefs": [
      "src_smithsonian_electric_refrigeration",
      "src_uchicago_monitor_top"
    ],
    "status": "verified",
    "verification": {
      "verifiedOn": "2026-08-11",
      "method": "independent_institutional_review",
      "independentSourceRefs": [
        "src_uchicago_monitor_top"
      ],
      "note": "La documentación del Smithsonian se contrastó con una exposición institucional de la University of Chicago sobre la línea Monitor Top."
    }
  },
  {
    "id": "haccp_development_1960s",
    "name": "Desarrollo inicial del sistema HACCP",
    "type": "food_safety",
    "period": {
      "start": 1960,
      "end": 1969,
      "precision": "decade",
      "display": "década de 1960"
    },
    "placeRefs": [],
    "contextRefs": [],
    "impactSubjectRefs": [],
    "impactTypes": [
      "improves_safety"
    ],
    "summary": "El enfoque Hazard Analysis and Critical Control Point fue desarrollado inicialmente por Pillsbury y NASA para reforzar la seguridad de los alimentos destinados a vuelos espaciales tripulados.",
    "certainty": "high",
    "sourceRefs": [
      "src_usda_haccp_2010",
      "src_nasa_haccp_2024",
      "src_national_academies_haccp"
    ],
    "status": "verified",
    "verification": {
      "verifiedOn": "2026-08-11",
      "method": "independent_government_and_academic_review",
      "independentSourceRefs": [
        "src_nasa_haccp_2024",
        "src_national_academies_haccp"
      ],
      "note": "La atribución USDA se contrastó con la historia oficial de NASA y una síntesis de National Academies sobre el origen y evolución de HACCP."
    }
  },
  {
    "id": "appert_preservation_1809_1810",
    "name": "Appertización y publicación del método de conserva",
    "type": "preservation_technology",
    "period": {
      "start": 1809,
      "end": 1810,
      "precision": "range",
      "display": "1809–1810"
    },
    "placeRefs": [],
    "contextRefs": [],
    "impactSubjectRefs": [],
    "impactTypes": [
      "extends_shelf_life",
      "enables"
    ],
    "summary": "Nicolas Appert fue premiado por un método de conservar alimentos mediante calentamiento y cierre de recipientes y publicó el procedimiento en 1810, antes de que existiese una explicación microbiológica del deterioro.",
    "certainty": "medium",
    "sourceRefs": [
      "src_appert_ucanr_2026"
    ],
    "status": "reviewed"
  },
  {
    "id": "codex_alimentarius_commission_1963",
    "name": "Constitución de la Comisión del Codex Alimentarius",
    "type": "regulation",
    "period": {
      "start": 1961,
      "end": 1963,
      "precision": "range",
      "display": "1961–1963"
    },
    "placeRefs": [],
    "contextRefs": [],
    "impactSubjectRefs": [],
    "impactTypes": [
      "standardizes",
      "improves_safety"
    ],
    "summary": "La Conferencia de la FAO aprobó en 1961 el establecimiento de la Comisión del Codex Alimentarius; la Asamblea Mundial de la Salud aprobó en 1963 el marco conjunto FAO/OMS, y la primera sesión de la Comisión se celebró en Roma del 25 de junio al 3 de julio de 1963. El Atlas representa así una secuencia constitutiva, no una creación instantánea en un único año.",
    "certainty": "high",
    "sourceRefs": [
      "src_codex_fao",
      "src_codex_fao_who_home",
      "src_codex_history_1961_1963",
      "src_codex_first_session_1963"
    ],
    "status": "verified",
    "verification": {
      "verifiedOn": "2026-08-11",
      "method": "official_fao_who_chronology_crosscheck",
      "independentSourceRefs": [
        "src_codex_history_1961_1963",
        "src_codex_first_session_1963"
      ],
      "note": "Se corrige la simplificación «creación en 1963»: FAO documenta resoluciones constitutivas en 1961 y 1963 y el informe oficial fija la primera sesión en junio-julio de 1963."
    }
  },
  {
    "id": "chorleywood_bread_process_1961",
    "name": "Proceso Chorleywood de panificación",
    "type": "industrial_process",
    "period": {
      "start": 1961,
      "end": 1961,
      "precision": "exact",
      "display": "1961"
    },
    "summary": "El proceso Chorleywood desarrolló la masa mediante mezcla mecánica de alta energía, sustituyendo las horas de fermentación en masa de métodos convencionales por minutos de trabajo intenso y acelerando la producción industrial de pan.",
    "certainty": "high",
    "impactSubjectRefs": [
      "bread_like_flatbread"
    ],
    "sourceRefs": [
      "src_chorleywood_bread_process_1966"
    ],
    "status": "reviewed"
  }
]
